{
  "id": "5fc1aca0-0000-4000-8000-000000000505",
  "schemaVersion": 9,
  "name": "Fixture Mara (SRD 5.2.1 human, level 1)",
  "rulesFamily": "srd-5.2.1",
  "level": 1,
  "classes": [
    {
      "class": {
        "contentId": "52c00000-0000-4000-8000-000000408000",
        "revisionId": "52e00000-0000-4000-8000-000000408000"
      },
      "level": 1
    }
  ],
  "choices": [
    {
      "source": {
        "contentId": "52c00000-0000-4000-8000-000000000002",
        "revisionId": "52e00000-0000-4000-8000-000000000002"
      },
      "choiceId": "soldier-ability-scores",
      "selected": [
        {
          "contentId": "52c00000-0000-4000-8000-000000000004",
          "revisionId": "52e00000-0000-4000-8000-000000000004"
        }
      ]
    },
    {
      "source": {
        "contentId": "52c00000-0000-4000-8000-000000408000",
        "revisionId": "52e00000-0000-4000-8000-000000408000"
      },
      "choiceId": "fighter-skills",
      "selected": [
        {
          "contentId": "52c00000-0000-4000-8000-000000408800",
          "revisionId": "52e00000-0000-4000-8000-000000408800"
        },
        {
          "contentId": "52c00000-0000-4000-8000-000000408801",
          "revisionId": "52e00000-0000-4000-8000-000000408801"
        }
      ]
    },
    {
      "source": {
        "contentId": "52c00000-0000-4000-8000-000000408001",
        "revisionId": "52e00000-0000-4000-8000-000000408001"
      },
      "choiceId": "fighting-style",
      "selected": [
        {
          "contentId": "52c00000-0000-4000-8000-000000408601",
          "revisionId": "52e00000-0000-4000-8000-000000408601"
        }
      ]
    },
    {
      "source": {
        "contentId": "52c00000-0000-4000-8000-000000500600",
        "revisionId": "52e00000-0000-4000-8000-000000500600"
      },
      "choiceId": "skillful",
      "selected": [
        {
          "contentId": "52c00000-0000-4000-8000-000000500617",
          "revisionId": "52e00000-0000-4000-8000-000000500617"
        }
      ]
    },
    {
      "source": {
        "contentId": "52c00000-0000-4000-8000-000000500600",
        "revisionId": "52e00000-0000-4000-8000-000000500600"
      },
      "choiceId": "versatile",
      "selected": [
        {
          "contentId": "52c00000-0000-4000-8000-000000520300",
          "revisionId": "52e00000-0000-4000-8000-000000520300"
        }
      ]
    },
    {
      "source": {
        "contentId": "52c00000-0000-4000-8000-000000520300",
        "revisionId": "52e00000-0000-4000-8000-000000520300"
      },
      "choiceId": "skilled-proficiencies",
      "selected": [
        {
          "contentId": "52c00000-0000-4000-8000-000000520303",
          "revisionId": "52e00000-0000-4000-8000-000000520303"
        },
        {
          "contentId": "52c00000-0000-4000-8000-000000520306",
          "revisionId": "52e00000-0000-4000-8000-000000520306"
        },
        {
          "contentId": "52c00000-0000-4000-8000-000000520310",
          "revisionId": "52e00000-0000-4000-8000-000000520310"
        }
      ]
    }
  ],
  "baseAbilities": {
    "str": 15,
    "dex": 13,
    "con": 14,
    "int": 10,
    "wis": 12,
    "cha": 8
  },
  "pins": [
    {
      "contentId": "52c00000-0000-4000-8000-000000500600",
      "revisionId": "52e00000-0000-4000-8000-000000500600"
    },
    {
      "contentId": "52c00000-0000-4000-8000-000000000002",
      "revisionId": "52e00000-0000-4000-8000-000000000002"
    }
  ],
  "overrides": [],
  "crossFamilyExceptions": [],
  "updatedAt": "2026-10-26T00:00:00+00:00"
}
