{
  "id": "5f0dca00-0000-4000-8000-000000000523",
  "schemaVersion": 9,
  "name": "Testy Wren (2024 fixture, schema v9)",
  "rulesFamily": "srd-5.2.1",
  "baseAbilities": { "str": 10, "dex": 14, "con": 12, "int": 10, "wis": 13, "cha": 8 },
  "pins": [
    { "contentId": "5f0dc000-0000-4000-8000-000000000002", "revisionId": "5f0de000-0000-4000-8000-000000000002" },
    { "contentId": "5f0dc000-0000-4000-8000-000000000003", "revisionId": "5f0de000-0000-4000-8000-000000000003" },
    { "contentId": "5f0dc000-0000-4000-8000-000000000005", "revisionId": "5f0de000-0000-4000-8000-000000000005" },
    { "contentId": "5f0dc000-0000-4000-8000-000000000006", "revisionId": "5f0de000-0000-4000-8000-000000000006" }
  ],
  "overrides": [],
  "xp": 900,
  "details": {
    "alignment": "Fixture neutral",
    "personalityTraits": "Fixture trait: carries every message twice.",
    "ideals": "Fixture ideal.",
    "bonds": "Fixture bond.",
    "flaws": "Fixture flaw.",
    "appearance": { "age": "27", "height": "5 ft", "eyes": "Grey" },
    "backstory": "Fixture backstory.",
    "alliesAndOrganisations": "The Fixture Couriers' Guild.",
    "languages": ["Common", "Fixture tongue"],
    "toolsAndOther": ["Fixture cartographer's kit"]
  },
  "customItems": [
    { "id": "5f0dca00-0000-4000-8000-0000000005a1", "name": "Fixture satchel", "quantity": 1, "note": "Waxed canvas.", "equipped": true },
    { "id": "5f0dca00-0000-4000-8000-0000000005a2", "name": "Fixture rations", "quantity": 5, "equipped": false }
  ],
  "customAttacks": [
    { "id": "5f0dca00-0000-4000-8000-0000000005b1", "name": "Fixture sling", "toHit": 4, "damage": "1d4+2", "damageType": "bludgeoning", "note": "Range 30/120." }
  ],
  "damageDefences": [
    { "type": "fire", "kind": "resistance" },
    { "type": "poison", "kind": "immunity" }
  ],
  "companions": [
    {
      "id": "5f0dca00-0000-4000-8000-0000000005c1",
      "name": "Fixture hound",
      "kind": "Beast",
      "armorClass": 12,
      "hitPointMaximum": 11,
      "speed": "40 ft",
      "attacks": [
        { "id": "5f0dca00-0000-4000-8000-0000000005c2", "name": "Fixture bite", "toHit": 3, "damage": "1d6+1", "damageType": "piercing" }
      ],
      "note": "Follows the courier."
    }
  ],
  "play": {
    "companions": [
      { "id": "5f0dca00-0000-4000-8000-0000000005c1", "current": 7, "temporary": 0 }
    ]
  },
  "updatedAt": "2026-10-16T00:00:00+00:00"
}
